{
  "$ref": "#/definitions/blameHunks",
  "definitions": {
    "blameHunks": {
      "type": "object",
      "properties": {
        "type": {
          "type": "string",
          "const": "blameHunks"
        },
        "path": {
          "type": "string"
        },
        "hunks": {
          "type": "array",
          "items": {
            "type": "object",
            "properties": {
              "start": {
                "type": "integer",
                "exclusiveMinimum": 0
              },
              "lines": {
                "type": "integer",
                "exclusiveMinimum": 0
              },
              "commit": {
                "type": "string"
              },
              "author": {
                "type": "string"
              },
              "date": {
                "type": "number"
              },
              "summary": {
                "type": "string"
              },
              "uncommitted": {
                "type": "boolean"
              }
            },
            "required": [
              "start",
              "lines",
              "commit",
              "author",
              "date",
              "summary"
            ],
            "additionalProperties": false
          }
        },
        "repoUrl": {
          "type": "string"
        },
        "id": {
          "type": "string"
        },
        "inReplyTo": {
          "type": "string"
        }
      },
      "required": [
        "type",
        "path",
        "hunks"
      ],
      "additionalProperties": false
    }
  },
  "$schema": "http://json-schema.org/draft-07/schema#"
}
